{
  "subject": {
    "identifier": "123456789",
    "type": "RegisteredNaturalPerson"
  },
   "attribute": {
    "attribute": "GivenName"
  },
  "evaluationTime": "2026-09-04T00:00:00Z",
  "lineage": [
    {
      "identifier": "request-001",
      "occurenceTime": "2025-05-01T00:00:00Z",
      "eventType": "GivenNameChangeRequest",
      "legalCase": {
        "identifier": "case-2025-001"
      },
      "oldValue": ["John"],
      "newValue": ["John", "James"],
      "effectivtyStart": "2025-07-01T00:00:00Z"
    },
    {
      "identifier": "outcome-001",
      "occurenceTime": "2025-06-15T00:00:00Z",
      "eventType": "GivenNameChangeOutcome",
      "legalCase": {
        "identifier": "case-2025-001"
      },
      "oldValue": ["John"],
      "newValue": ["John", "James"],
      "effectivtyStart": "2025-07-01T00:00:00Z"
    },
    {
      "identifier": "request-002",
      "occurenceTime": "2026-02-01T00:00:00Z",
      "eventType": "GivenNameChangeRequest",
      "legalCase": {
        "identifier": "case-2026-002"
      },
      "oldValue": ["John", "James"],
      "newValue": ["John James"],
      "effectivtyStart": "2026-03-16T00:00:00Z"
    },
    {
      "identifier": "outcome-002",
      "occurenceTime": "2026-03-10T00:00:00Z",
      "eventType": "GivenNameChangeOutcome",
      "legalCase": {
        "identifier": "case-2026-002"
      },
      "oldValue": ["John", "James"],
      "newValue": ["John James"],
      "effectivtyStart": "2026-03-16T00:00:00Z"
    }
  ]
}
